{
  "module_code": "M22",
  "vector": 1,
  "name": "SOP Lead Gen (Make+Notion+Telegram)",
  "purpose": "Blueprint de orchestrare lead capture cu retries È™i fallback DM pe Telegram.",
  "tags": ["leadgen", "automation", "telegram"],
  "status": "stable",
  "semver": "0.1.0",
  "inputs": { "sevenD_contract": { "required": ["domain", "output"], "output_must_be_one_of": ["bundle", "json"] }, "schema": { "type": "object", "required": ["forms", "db_schema", "bot"], "properties": { "forms": { "type": "array", "minItems": 1, "items": { "type": "string" } }, "db_schema": { "type": "string" }, "bot": { "type": "string" } } }, "example": { "forms": ["lead"], "db_schema": "notion.contacts", "bot": "@lead_bot" } },
  "outputs": { "artifact_type": "bundle", "fields": [ { "name": "blueprints", "type": "string", "required": true }, { "name": "dlq", "type": "json", "required": true } ] },
  "kpi": { "score_min": 80 },
  "tests": [ { "id": "M22-T1", "name": "Blueprint + DLQ", "input": { "custom": { "forms": ["f"], "db_schema": "s", "bot": "b" } }, "assert": { "schema_ok": true, "output_spec_complete": true, "kpi_min": 80 } } ],
  "guardrails": { "privacy_safe": true, "respect_style": true, "no_unfounded_claims": true },
  "deps": [],
  "evaluation_hooks": ["clarity", "execution", "ambiguity", "business_fit"],
  "telemetry_keys": ["run_id", "model", "tokens_in", "tokens_out", "scores", "policy_hits"]
}


