{
  "module_code": "M44",
  "vector": 7,
  "name": "Ethical Guardrails în GPT",
  "purpose": "Reguli executabile (allow/refuse/redirect) cu teste și jurnalizare pentru audit.",
  "tags": ["ethics", "policy", "tests"],
  "status": "stable",
  "semver": "0.1.0",
  "inputs": { "sevenD_contract": { "required": ["domain", "output"], "output_must_be_one_of": ["bundle", "json"] }, "schema": { "type": "object", "required": ["allow", "refuse", "redirect", "msg_templates"], "properties": { "allow": { "type": "array", "minItems": 1, "items": { "type": "string" } }, "refuse": { "type": "array", "minItems": 1, "items": { "type": "string" } }, "redirect": { "type": "array", "minItems": 0, "items": { "type": "string" } }, "msg_templates": { "type": "object" } } }, "example": { "allow": ["safe"], "refuse": ["pii"], "redirect": ["support"], "msg_templates": {} } },
  "outputs": { "artifact_type": "bundle", "fields": [ { "name": "policies", "type": "json", "required": true }, { "name": "tests_yaml", "type": "string", "required": true }, { "name": "logs", "type": "json", "required": false } ] },
  "kpi": { "score_min": 80 },
  "tests": [ { "id": "M44-T1", "name": "Policies + tests", "input": { "custom": { "allow": ["a"], "refuse": ["r"], "redirect": [], "msg_templates": {} } }, "assert": { "schema_ok": true, "output_spec_complete": true, "kpi_min": 80 } } ],
  "guardrails": { "privacy_safe": true, "respect_style": true, "no_unfounded_claims": true },
  "deps": [],
  "evaluation_hooks": ["clarity", "execution", "ambiguity", "business_fit"],
  "telemetry_keys": ["run_id", "model", "tokens_in", "tokens_out", "scores", "policy_hits"]
}


